{
  "famille": "perso-armes",
  "label": "Personnalisation des armes",
  "titre": "Tous les postes de personnalisation des armes",
  "page": "/personnalisations.html",
  "section": "perso-armes",
  "suivi": {
    "cle": "lk_own_perso-armes",
    "label": "Mes modifs d’arme",
    "fait": "posées",
    "ancre": "perso-armes"
  },
  "intro": "Chargeurs, viseurs, silencieux, poignées, lampes, finitions, camouflages et munitions spéciales : ce que Rockstar a dit ou montré pour GTA VI (variantes gravées de l’Édition Ultimate, motif du Pack Vintage, casiers d’Ammu-Nation), puis ce qu’Ammu-Nation et l’atelier d’armes de GTA Online proposent, avec leurs prix présentés comme repères. Quand une arme compatible est connue, la ligne renvoie à sa fiche ; sinon la compatibilité reste à confirmer.",
  "categories": [
    {
      "id": "variantes",
      "label": "Variantes complètes",
      "icon": "kit"
    },
    {
      "id": "chargeurs",
      "label": "Chargeurs",
      "icon": "chargeur"
    },
    {
      "id": "viseurs",
      "label": "Viseurs et lunettes",
      "icon": "viseur"
    },
    {
      "id": "canons",
      "label": "Silencieux et canons",
      "icon": "silencieux"
    },
    {
      "id": "poignees",
      "label": "Poignées et crosses",
      "icon": "poignee"
    },
    {
      "id": "lampes",
      "label": "Lampes et lasers",
      "icon": "lampe-torche"
    },
    {
      "id": "finitions",
      "label": "Finitions et gravures",
      "icon": "finition"
    },
    {
      "id": "camouflages",
      "label": "Camouflages et livrées",
      "icon": "camouflage"
    },
    {
      "id": "munitions-speciales",
      "label": "Munitions spéciales",
      "icon": "munitions"
    },
    {
      "id": "conversion",
      "label": "Conversion Mk II",
      "icon": "conversion"
    },
    {
      "id": "armurerie",
      "label": "Armurerie et casier",
      "icon": "casier"
    }
  ],
  "items": [
    {
      "id": "variante-girardi-es9",
      "nom": "Girardi ES9 gravé de Jason",
      "categorie": "variantes",
      "statut": "officiel",
      "personnage": "jason",
      "media": "personalized-weapon-variants",
      "description": "Version personnalisée du pistolet de Jason dans l’Édition Ultimate : « detailed engravings » ; sur la capture, « J. Duval » sur la glissière et crosse gravée.",
      "effet": {
        "texte": "Visuel : gravures ; aucune différence de tir publiée",
        "valeur": null,
        "unite": null,
        "jeu": null
      },
      "prix_gta6": {
        "valeur": null,
        "statut": "conf"
      },
      "prix_repere_serie": null,
      "ou_le_trouver": [
        {
          "type": "Livré avec l’Édition Ultimate"
        }
      ],
      "variantes": [],
      "sources": [
        "vgc-editions",
        "rs-screens"
      ],
      "lien": {
        "href": "armes/girardi-es9.html",
        "label": "fiche du Girardi ES9"
      },
      "compat": {
        "armes": [
          "pistolet"
        ],
        "ids": [
          "girardi-es9"
        ]
      },
      "notes": ""
    },
    {
      "id": "variante-klose-k17",
      "nom": "Klose K17 gravé de Lucia",
      "categorie": "variantes",
      "statut": "officiel",
      "personnage": "lucia",
      "media": "personalized-weapon-variants",
      "description": "Version personnalisée du pistolet de Lucia : carcasse bordeaux, rose tatouée et prénom « Lucia » gravés sur la capture officielle.",
      "effet": {
        "texte": "Visuel : gravures ; aucune différence de tir publiée",
        "valeur": null,
        "unite": null,
        "jeu": null
      },
      "prix_gta6": {
        "valeur": null,
        "statut": "conf"
      },
      "prix_repere_serie": null,
      "ou_le_trouver": [
        {
          "type": "Livré avec l’Édition Ultimate"
        }
      ],
      "variantes": [],
      "sources": [
        "vgc-editions",
        "rs-screens"
      ],
      "lien": {
        "href": "armes/klose-k17.html",
        "label": "fiche du Klose K17"
      },
      "compat": {
        "armes": [
          "pistolet"
        ],
        "ids": [
          "klose-k17"
        ]
      },
      "notes": ""
    },
    {
      "id": "variante-morgan",
      "nom": "Hawk & Little Morgan « his and hers »",
      "categorie": "variantes",
      "statut": "officiel",
      "personnage": "jason-lucia",
      "media": "hawk-little-morgan-revolvers-02",
      "description": "Deux revolvers aux couleurs de Vice City tirés du domaine Vercetti : crosses gravées de palmiers, gravures, lunette « high-performance » et finitions personnalisées.",
      "effet": {
        "texte": "Lunette « high-performance » citée par Rockstar ; rien de chiffré",
        "valeur": null,
        "unite": null,
        "jeu": null
      },
      "prix_gta6": {
        "valeur": null,
        "statut": "conf"
      },
      "prix_repere_serie": null,
      "ou_le_trouver": [
        {
          "type": "Livré avec l’Édition Ultimate"
        }
      ],
      "variantes": [],
      "sources": [
        "vgc-editions",
        "sixthaxis-editions"
      ],
      "lien": {
        "href": "armes/hawk-little-morgan.html",
        "label": "fiche du Morgan"
      },
      "compat": {
        "armes": [
          "pistolet"
        ],
        "ids": [
          "hawk-little-morgan"
        ]
      },
      "notes": ""
    },
    {
      "id": "plus-d-options",
      "nom": "Plus d’options que jamais (Rob Nelson)",
      "categorie": "variantes",
      "statut": "officiel",
      "description": "« There are also more weapon customization options than ever before » : Rob Nelson à Famitsu, sans détail ni liste.",
      "effet": {
        "texte": "Aucun détail publié",
        "valeur": null,
        "unite": null,
        "jeu": null
      },
      "prix_gta6": {
        "valeur": null,
        "statut": "conf"
      },
      "prix_repere_serie": null,
      "ou_le_trouver": [
        {
          "lieu": "g-L1074"
        },
        {
          "lieu": "g-L1091"
        },
        {
          "lieu": "g-L298"
        }
      ],
      "variantes": [],
      "sources": [
        "gtavice-famitsu",
        "famitsu-nelson"
      ],
      "compat": {
        "armes": [
          "pistolet",
          "pm",
          "assaut",
          "precision",
          "mitrailleuse",
          "pompe"
        ]
      },
      "notes": ""
    },
    {
      "id": "motif-vintage-vice-city",
      "nom": "Motif tropical du Pack Vintage Vice City",
      "categorie": "camouflages",
      "statut": "officiel",
      "media": "vintage-vice-city-weapon-pattern-01",
      "suivi": false,
      "description": "Motif tropical inspiré de la chemise de Tommy Vercetti, « available to adorn most guns » ; sur la capture, un PM à crosse rabattable et un pistolet le portent.",
      "effet": {
        "texte": "Visuel ; rien de chiffré",
        "valeur": null,
        "unite": null,
        "jeu": null
      },
      "prix_gta6": {
        "valeur": null,
        "statut": "conf"
      },
      "prix_repere_serie": null,
      "ou_le_trouver": [
        {
          "type": "Bonus de précommande",
          "note": "Pack Vintage Vice City, avant le 20 novembre 2026"
        }
      ],
      "variantes": [],
      "sources": [
        "sixthaxis-editions",
        "xbox-vintage",
        "rs-screens"
      ],
      "compat": {
        "armes": [
          "pistolet",
          "pm",
          "assaut",
          "precision",
          "mitrailleuse",
          "pompe"
        ],
        "ids": [
          "pm-tactique",
          "girardi-es9"
        ],
        "note": "armes vues sur la capture ; « la plupart des armes » sans liste",
        "exemples": true
      },
      "acq": "vintage-weapon-pattern",
      "notes": "La case « J’ai obtenu » est celle de la carte Rockstar plus haut."
    },
    {
      "id": "camouflages-mk2",
      "nom": "Camouflages Mk II",
      "categorie": "camouflages",
      "statut": "serie",
      "description": "Digital, coup de pinceau, forêt, crâne, léopard, zèbre, géométrique, Perseus, Boom, patriotique : dix livrées pour les armes Mk II de GTA Online.",
      "effet": {
        "texte": "Visuel uniquement",
        "valeur": null,
        "unite": null,
        "jeu": null
      },
      "prix_gta6": {
        "valeur": null,
        "statut": "conf"
      },
      "prix_repere_serie": {
        "min": 40000,
        "max": 100000,
        "jeu": "GTA Online",
        "note": "digital 40 000 $ … patriotique 100 000 $"
      },
      "ou_le_trouver": [
        {
          "type": "Atelier d’armes",
          "note": "repère : Weapon Workshop, GTA Online"
        }
      ],
      "variantes": [
        "digital",
        "coup de pinceau",
        "forêt",
        "crâne",
        "léopard",
        "zèbre",
        "géométrique",
        "Perseus",
        "Boom",
        "patriotique"
      ],
      "sources": [
        "gtawiki-carbine-mk2",
        "gtawiki-pistol-mk2"
      ],
      "compat": {
        "armes": [
          "pistolet",
          "pm",
          "assaut",
          "precision",
          "mitrailleuse",
          "pompe"
        ]
      },
      "notes": ""
    },
    {
      "id": "finition-doree",
      "nom": "Finition dorée (vue)",
      "categorie": "finitions",
      "statut": "vu",
      "media": "vice-city-12",
      "description": "Un fusil à silhouette AK entièrement doré apparaît dans une capture officielle de Vice City : une finition vue, sans nom ni prix.",
      "effet": {
        "texte": "Visuel ; rien de chiffré",
        "valeur": null,
        "unite": null,
        "jeu": null
      },
      "prix_gta6": {
        "valeur": null,
        "statut": "conf"
      },
      "prix_repere_serie": null,
      "ou_le_trouver": [
        {
          "type": "Non précisé par Rockstar"
        }
      ],
      "variantes": [],
      "sources": [
        "rs-screens"
      ],
      "compat": {
        "armes": [